{
  "$schema": "../../schema/prijzen-actueel.schema.json",
  "versie": 1,
  "gegenereerdOp": "2026-09-24T16:13:33.409Z",
  "vandaag": {
    "$schema": "../../../schema/prijzen.schema.json",
    "versie": 1,
    "datum": "2026-09-24",
    "tijdzone": "Europe/Amsterdam",
    "valuta": "EUR",
    "btw": "exclusief",
    "opgehaaldOp": "2026-09-24T16:13:33.400Z",
    "stroom": {
      "eenheid": "EUR/kWh",
      "bron": "energyzero",
      "perUur": [
        {
          "start": "2026-09-24T00:00:00+02:00",
          "startUtc": "2026-09-23T22:00:00Z",
          "prijs": 0.155292
        },
        {
          "start": "2026-09-24T01:00:00+02:00",
          "startUtc": "2026-09-23T23:00:00Z",
          "prijs": 0.152602
        },
        {
          "start": "2026-09-24T02:00:00+02:00",
          "startUtc": "2026-09-24T00:00:00Z",
          "prijs": 0.13039
        },
        {
          "start": "2026-09-24T03:00:00+02:00",
          "startUtc": "2026-09-24T01:00:00Z",
          "prijs": 0.153123
        },
        {
          "start": "2026-09-24T04:00:00+02:00",
          "startUtc": "2026-09-24T02:00:00Z",
          "prijs": 0.153952
        },
        {
          "start": "2026-09-24T05:00:00+02:00",
          "startUtc": "2026-09-24T03:00:00Z",
          "prijs": 0.158365
        },
        {
          "start": "2026-09-24T06:00:00+02:00",
          "startUtc": "2026-09-24T04:00:00Z",
          "prijs": 0.17356
        },
        {
          "start": "2026-09-24T07:00:00+02:00",
          "startUtc": "2026-09-24T05:00:00Z",
          "prijs": 0.218002
        },
        {
          "start": "2026-09-24T08:00:00+02:00",
          "startUtc": "2026-09-24T06:00:00Z",
          "prijs": 0.206477
        },
        {
          "start": "2026-09-24T09:00:00+02:00",
          "startUtc": "2026-09-24T07:00:00Z",
          "prijs": 0.161105
        },
        {
          "start": "2026-09-24T10:00:00+02:00",
          "startUtc": "2026-09-24T08:00:00Z",
          "prijs": 0.115062
        },
        {
          "start": "2026-09-24T11:00:00+02:00",
          "startUtc": "2026-09-24T09:00:00Z",
          "prijs": 0.085245
        },
        {
          "start": "2026-09-24T12:00:00+02:00",
          "startUtc": "2026-09-24T10:00:00Z",
          "prijs": 0.052763
        },
        {
          "start": "2026-09-24T13:00:00+02:00",
          "startUtc": "2026-09-24T11:00:00Z",
          "prijs": 0.03941
        },
        {
          "start": "2026-09-24T14:00:00+02:00",
          "startUtc": "2026-09-24T12:00:00Z",
          "prijs": 0.03903
        },
        {
          "start": "2026-09-24T15:00:00+02:00",
          "startUtc": "2026-09-24T13:00:00Z",
          "prijs": 0.079988
        },
        {
          "start": "2026-09-24T16:00:00+02:00",
          "startUtc": "2026-09-24T14:00:00Z",
          "prijs": 0.12056
        },
        {
          "start": "2026-09-24T17:00:00+02:00",
          "startUtc": "2026-09-24T15:00:00Z",
          "prijs": 0.17137
        },
        {
          "start": "2026-09-24T18:00:00+02:00",
          "startUtc": "2026-09-24T16:00:00Z",
          "prijs": 0.22118
        },
        {
          "start": "2026-09-24T19:00:00+02:00",
          "startUtc": "2026-09-24T17:00:00Z",
          "prijs": 0.2677
        },
        {
          "start": "2026-09-24T20:00:00+02:00",
          "startUtc": "2026-09-24T18:00:00Z",
          "prijs": 0.26
        },
        {
          "start": "2026-09-24T21:00:00+02:00",
          "startUtc": "2026-09-24T19:00:00Z",
          "prijs": 0.225855
        },
        {
          "start": "2026-09-24T22:00:00+02:00",
          "startUtc": "2026-09-24T20:00:00Z",
          "prijs": 0.204997
        },
        {
          "start": "2026-09-24T23:00:00+02:00",
          "startUtc": "2026-09-24T21:00:00Z",
          "prijs": 0.188222
        }
      ]
    },
    "gas": {
      "eenheid": "EUR/m3",
      "bron": "energyzero",
      "perUur": [
        {
          "start": "2026-09-24T00:00:00+02:00",
          "startUtc": "2026-09-23T22:00:00Z",
          "prijs": 0.73
        },
        {
          "start": "2026-09-24T01:00:00+02:00",
          "startUtc": "2026-09-23T23:00:00Z",
          "prijs": 0.73
        },
        {
          "start": "2026-09-24T02:00:00+02:00",
          "startUtc": "2026-09-24T00:00:00Z",
          "prijs": 0.73
        },
        {
          "start": "2026-09-24T03:00:00+02:00",
          "startUtc": "2026-09-24T01:00:00Z",
          "prijs": 0.73
        },
        {
          "start": "2026-09-24T04:00:00+02:00",
          "startUtc": "2026-09-24T02:00:00Z",
          "prijs": 0.73
        },
        {
          "start": "2026-09-24T05:00:00+02:00",
          "startUtc": "2026-09-24T03:00:00Z",
          "prijs": 0.73
        },
        {
          "start": "2026-09-24T06:00:00+02:00",
          "startUtc": "2026-09-24T04:00:00Z",
          "prijs": 0.71
        },
        {
          "start": "2026-09-24T07:00:00+02:00",
          "startUtc": "2026-09-24T05:00:00Z",
          "prijs": 0.71
        },
        {
          "start": "2026-09-24T08:00:00+02:00",
          "startUtc": "2026-09-24T06:00:00Z",
          "prijs": 0.71
        },
        {
          "start": "2026-09-24T09:00:00+02:00",
          "startUtc": "2026-09-24T07:00:00Z",
          "prijs": 0.71
        },
        {
          "start": "2026-09-24T10:00:00+02:00",
          "startUtc": "2026-09-24T08:00:00Z",
          "prijs": 0.71
        },
        {
          "start": "2026-09-24T11:00:00+02:00",
          "startUtc": "2026-09-24T09:00:00Z",
          "prijs": 0.71
        },
        {
          "start": "2026-09-24T12:00:00+02:00",
          "startUtc": "2026-09-24T10:00:00Z",
          "prijs": 0.71
        },
        {
          "start": "2026-09-24T13:00:00+02:00",
          "startUtc": "2026-09-24T11:00:00Z",
          "prijs": 0.71
        },
        {
          "start": "2026-09-24T14:00:00+02:00",
          "startUtc": "2026-09-24T12:00:00Z",
          "prijs": 0.71
        },
        {
          "start": "2026-09-24T15:00:00+02:00",
          "startUtc": "2026-09-24T13:00:00Z",
          "prijs": 0.71
        },
        {
          "start": "2026-09-24T16:00:00+02:00",
          "startUtc": "2026-09-24T14:00:00Z",
          "prijs": 0.71
        },
        {
          "start": "2026-09-24T17:00:00+02:00",
          "startUtc": "2026-09-24T15:00:00Z",
          "prijs": 0.71
        },
        {
          "start": "2026-09-24T18:00:00+02:00",
          "startUtc": "2026-09-24T16:00:00Z",
          "prijs": 0.71
        },
        {
          "start": "2026-09-24T19:00:00+02:00",
          "startUtc": "2026-09-24T17:00:00Z",
          "prijs": 0.71
        },
        {
          "start": "2026-09-24T20:00:00+02:00",
          "startUtc": "2026-09-24T18:00:00Z",
          "prijs": 0.71
        },
        {
          "start": "2026-09-24T21:00:00+02:00",
          "startUtc": "2026-09-24T19:00:00Z",
          "prijs": 0.71
        },
        {
          "start": "2026-09-24T22:00:00+02:00",
          "startUtc": "2026-09-24T20:00:00Z",
          "prijs": 0.71
        },
        {
          "start": "2026-09-24T23:00:00+02:00",
          "startUtc": "2026-09-24T21:00:00Z",
          "prijs": 0.71
        }
      ]
    }
  },
  "morgen": {
    "$schema": "../../../schema/prijzen.schema.json",
    "versie": 1,
    "datum": "2026-09-25",
    "tijdzone": "Europe/Amsterdam",
    "valuta": "EUR",
    "btw": "exclusief",
    "opgehaaldOp": "2026-09-24T16:13:33.407Z",
    "stroom": {
      "eenheid": "EUR/kWh",
      "bron": "energyzero",
      "perUur": [
        {
          "start": "2026-09-25T00:00:00+02:00",
          "startUtc": "2026-09-24T22:00:00Z",
          "prijs": 0.181983
        },
        {
          "start": "2026-09-25T01:00:00+02:00",
          "startUtc": "2026-09-24T23:00:00Z",
          "prijs": 0.1722
        },
        {
          "start": "2026-09-25T02:00:00+02:00",
          "startUtc": "2026-09-25T00:00:00Z",
          "prijs": 0.16493
        },
        {
          "start": "2026-09-25T03:00:00+02:00",
          "startUtc": "2026-09-25T01:00:00Z",
          "prijs": 0.164477
        },
        {
          "start": "2026-09-25T04:00:00+02:00",
          "startUtc": "2026-09-25T02:00:00Z",
          "prijs": 0.16117
        },
        {
          "start": "2026-09-25T05:00:00+02:00",
          "startUtc": "2026-09-25T03:00:00Z",
          "prijs": 0.165863
        },
        {
          "start": "2026-09-25T06:00:00+02:00",
          "startUtc": "2026-09-25T04:00:00Z",
          "prijs": 0.1799
        },
        {
          "start": "2026-09-25T07:00:00+02:00",
          "startUtc": "2026-09-25T05:00:00Z",
          "prijs": 0.20757
        },
        {
          "start": "2026-09-25T08:00:00+02:00",
          "startUtc": "2026-09-25T06:00:00Z",
          "prijs": 0.21246
        },
        {
          "start": "2026-09-25T09:00:00+02:00",
          "startUtc": "2026-09-25T07:00:00Z",
          "prijs": 0.194707
        },
        {
          "start": "2026-09-25T10:00:00+02:00",
          "startUtc": "2026-09-25T08:00:00Z",
          "prijs": 0.155007
        },
        {
          "start": "2026-09-25T11:00:00+02:00",
          "startUtc": "2026-09-25T09:00:00Z",
          "prijs": 0.106008
        },
        {
          "start": "2026-09-25T12:00:00+02:00",
          "startUtc": "2026-09-25T10:00:00Z",
          "prijs": 0.061683
        },
        {
          "start": "2026-09-25T13:00:00+02:00",
          "startUtc": "2026-09-25T11:00:00Z",
          "prijs": 0.034928
        },
        {
          "start": "2026-09-25T14:00:00+02:00",
          "startUtc": "2026-09-25T12:00:00Z",
          "prijs": 0.043635
        },
        {
          "start": "2026-09-25T15:00:00+02:00",
          "startUtc": "2026-09-25T13:00:00Z",
          "prijs": 0.085855
        },
        {
          "start": "2026-09-25T16:00:00+02:00",